pub_date	title	venue	excerpt	citation	url_slug	paper_url	slides_url
2022-12-01	Helping the Weak Makes You Strong: Simple Multi-Task Learning Improves Non-Autoregressive Translators	EMNLP	<strong>Xinyou Wang</strong>, Zaixiang Zheng, and Shujian Huang	<strong>Xinyou Wang</strong>, Zaixiang Zheng, and Shujian Huang. (2022). "Helping the Weak Makes You Strong: Simple Multi-Task Learning Improves Non-Autoregressive Translators." <i>Proceedings of the 2022 Conference on Empirical Methods in Natural Language Processing</i>, 5513-5519.	helping-the-weak-makes-you-strong-simple-multi-task-learning-improves-non-autoregressive-translators	https://arxiv.org/pdf/2211.06075	
2024-07-21	Diffusion Language Models Are Versatile Protein Learners	ICML	<strong>Xinyou Wang</strong>, Zaixiang Zheng, Fei Ye, Dongyu Xue, Shujian Huang, and Quanquan Gu	<strong>Xinyou Wang</strong>, Zaixiang Zheng, Fei Ye, Dongyu Xue, Shujian Huang, and Quanquan Gu. (2024). "Diffusion Language Models Are Versatile Protein Learners." <i>Proceedings of the 41st International Conference on Machine Learning</i>, 52309-52333.	diffusion-language-models-are-versatile-protein-learners	https://arxiv.org/pdf/2402.18567	
2025-04-24	DPLM-2: A Multimodal Diffusion Protein Language Model	ICLR	<strong>Xinyou Wang</strong>, Zaixiang Zheng, Fei Ye, Dongyu Xue, Shujian Huang, and Quanquan Gu	<strong>Xinyou Wang</strong>, Zaixiang Zheng, Fei Ye, Dongyu Xue, Shujian Huang, and Quanquan Gu. (2025). "DPLM-2: A Multimodal Diffusion Protein Language Model." <i>International Conference on Learning Representations</i>.	dplm-2-a-multimodal-diffusion-protein-language-model	https://arxiv.org/pdf/2410.13782	
2025-04-24	ProteinBench: A Holistic Evaluation of Protein Foundation Models	ICLR	Fei Ye, Zaixiang Zheng, Dongyu Xue, Yuning Shen, Lihao Wang, Yiming Ma, Yan Wang, <strong>Xinyou Wang</strong>, Xiangxin Zhou, and Quanquan Gu	Fei Ye, Zaixiang Zheng, Dongyu Xue, Yuning Shen, Lihao Wang, Yiming Ma, Yan Wang, <strong>Xinyou Wang</strong>, Xiangxin Zhou, and Quanquan Gu. (2025). "ProteinBench: A Holistic Evaluation of Protein Foundation Models." <i>International Conference on Learning Representations</i>.	proteinbench-a-holistic-evaluation-of-protein-foundation-models	https://arxiv.org/pdf/2409.06744	
2025-07-13	Elucidating the Design Space of Multimodal Protein Language Models	ICML	Cheng-Yen Hsieh, <strong>Xinyou Wang</strong>, Daiheng Zhang, Dongyu Xue, Fei Ye, Shujian Huang, Zaixiang Zheng, and Quanquan Gu	Cheng-Yen Hsieh, <strong>Xinyou Wang</strong>, Daiheng Zhang, Dongyu Xue, Fei Ye, Shujian Huang, Zaixiang Zheng, and Quanquan Gu. (2025). "Elucidating the Design Space of Multimodal Protein Language Models." <i>Proceedings of the 42nd International Conference on Machine Learning</i>, 24156-24175.	elucidating-the-design-space-of-multimodal-protein-language-models	https://arxiv.org/pdf/2504.11454	
